{
  "schema_version": "v1",
  "plan_version": "1.0.0",
  "environment": {
    "kind": "ephemeral_staging",
    "isolation": "per_run",
    "ttl_minutes": 120,
    "destroy_after_run": true,
    "production_credentials_allowed": false,
    "production_data_allowed": false,
    "network_mode": "loopback_only",
    "database_strategy": "fresh_database_per_run",
    "browser_e2e_enabled": false
  },
  "identity": {
    "strategy": "service_credentials_only_until_human_idp_approved",
    "browser_session_status": "blocked_pending_human_idp_bff",
    "credential_material_source": "runtime_injected_ephemeral",
    "raw_secrets_in_manifest": false,
    "secret_persistence": "forbidden",
    "browser_blocker_ids": [
      "BLK-HUMAN-IDP-BFF-001",
      "BLK-AUTHENTICATED-UI-001"
    ]
  },
  "tenants": [
    {
      "id": "11111111-1111-4111-8111-111111111111",
      "slug": "tenant-a-synthetic",
      "classification": "synthetic_test",
      "authoritative": false
    },
    {
      "id": "22222222-2222-4222-8222-222222222222",
      "slug": "tenant-b-synthetic",
      "classification": "synthetic_test",
      "authoritative": false
    }
  ],
  "principals": [
    {
      "id": "a0000000-0000-4000-8000-000000000001",
      "key": "tenant-a-platform-admin",
      "tenant_id": "11111111-1111-4111-8111-111111111111",
      "roles": [
        "platform_admin"
      ],
      "credential_ref": "ephemeral-credential-tenant-a-platform-admin",
      "credential_kind": "ephemeral_bearer_digest_reference",
      "surface": "api_and_planned_browser"
    },
    {
      "id": "a0000000-0000-4000-8000-000000000002",
      "key": "tenant-a-tenant-admin",
      "tenant_id": "11111111-1111-4111-8111-111111111111",
      "roles": [
        "tenant_admin"
      ],
      "credential_ref": "ephemeral-credential-tenant-a-tenant-admin",
      "credential_kind": "ephemeral_bearer_digest_reference",
      "surface": "api_and_planned_browser"
    },
    {
      "id": "a0000000-0000-4000-8000-000000000003",
      "key": "tenant-a-document-manager",
      "tenant_id": "11111111-1111-4111-8111-111111111111",
      "roles": [
        "document_manager"
      ],
      "credential_ref": "ephemeral-credential-tenant-a-document-manager",
      "credential_kind": "ephemeral_bearer_digest_reference",
      "surface": "api_and_planned_browser"
    },
    {
      "id": "a0000000-0000-4000-8000-000000000004",
      "key": "tenant-a-researcher",
      "tenant_id": "11111111-1111-4111-8111-111111111111",
      "roles": [
        "researcher"
      ],
      "credential_ref": "ephemeral-credential-tenant-a-researcher",
      "credential_kind": "ephemeral_bearer_digest_reference",
      "surface": "api_and_planned_browser"
    },
    {
      "id": "a0000000-0000-4000-8000-000000000005",
      "key": "tenant-a-procedure-author",
      "tenant_id": "11111111-1111-4111-8111-111111111111",
      "roles": [
        "procedure_author"
      ],
      "credential_ref": "ephemeral-credential-tenant-a-procedure-author",
      "credential_kind": "ephemeral_bearer_digest_reference",
      "surface": "api_and_planned_browser"
    },
    {
      "id": "a0000000-0000-4000-8000-000000000006",
      "key": "tenant-a-procedure-reviewer",
      "tenant_id": "11111111-1111-4111-8111-111111111111",
      "roles": [
        "procedure_reviewer"
      ],
      "credential_ref": "ephemeral-credential-tenant-a-procedure-reviewer",
      "credential_kind": "ephemeral_bearer_digest_reference",
      "surface": "api_and_planned_browser"
    },
    {
      "id": "a0000000-0000-4000-8000-000000000007",
      "key": "tenant-a-procedure-approver",
      "tenant_id": "11111111-1111-4111-8111-111111111111",
      "roles": [
        "procedure_approver"
      ],
      "credential_ref": "ephemeral-credential-tenant-a-procedure-approver",
      "credential_kind": "ephemeral_bearer_digest_reference",
      "surface": "api_and_planned_browser"
    },
    {
      "id": "a0000000-0000-4000-8000-000000000008",
      "key": "tenant-a-case-operator",
      "tenant_id": "11111111-1111-4111-8111-111111111111",
      "roles": [
        "case_operator"
      ],
      "credential_ref": "ephemeral-credential-tenant-a-case-operator",
      "credential_kind": "ephemeral_bearer_digest_reference",
      "surface": "api_and_planned_browser"
    },
    {
      "id": "a0000000-0000-4000-8000-000000000009",
      "key": "tenant-a-viewer",
      "tenant_id": "11111111-1111-4111-8111-111111111111",
      "roles": [
        "viewer"
      ],
      "credential_ref": "ephemeral-credential-tenant-a-viewer",
      "credential_kind": "ephemeral_bearer_digest_reference",
      "surface": "api_and_planned_browser"
    },
    {
      "id": "a0000000-0000-4000-8000-000000000010",
      "key": "tenant-a-integration-client",
      "tenant_id": "11111111-1111-4111-8111-111111111111",
      "roles": [
        "integration_client"
      ],
      "credential_ref": "ephemeral-credential-tenant-a-integration-client",
      "credential_kind": "ephemeral_bearer_digest_reference",
      "surface": "api"
    },
    {
      "id": "b0000000-0000-4000-8000-000000000001",
      "key": "tenant-b-viewer",
      "tenant_id": "22222222-2222-4222-8222-222222222222",
      "roles": [
        "viewer"
      ],
      "credential_ref": "ephemeral-credential-tenant-b-viewer",
      "credential_kind": "ephemeral_bearer_digest_reference",
      "surface": "api_and_planned_browser"
    }
  ],
  "role_matrix": [
    {
      "role": "platform_admin",
      "permissions": [
        "platform:admin",
        "tenant:manage",
        "identity:manage",
        "source:read",
        "source:write",
        "document:read",
        "document:write",
        "document:ingest",
        "evidence:query",
        "procedure:read",
        "procedure:draft",
        "procedure:review",
        "procedure:approve",
        "case:read",
        "case:write",
        "audit:read",
        "integration:query"
      ],
      "api_required": true,
      "browser_required": true
    },
    {
      "role": "tenant_admin",
      "permissions": [
        "tenant:manage",
        "identity:manage",
        "source:read",
        "source:write",
        "document:read",
        "document:write",
        "document:ingest",
        "evidence:query",
        "procedure:read",
        "procedure:draft",
        "procedure:review",
        "case:read",
        "case:write",
        "audit:read"
      ],
      "api_required": true,
      "browser_required": true
    },
    {
      "role": "document_manager",
      "permissions": [
        "source:read",
        "source:write",
        "document:read",
        "document:write",
        "document:ingest",
        "evidence:query",
        "procedure:read"
      ],
      "api_required": true,
      "browser_required": true
    },
    {
      "role": "researcher",
      "permissions": [
        "source:read",
        "document:read",
        "evidence:query",
        "procedure:read",
        "case:read"
      ],
      "api_required": true,
      "browser_required": true
    },
    {
      "role": "procedure_author",
      "permissions": [
        "source:read",
        "document:read",
        "evidence:query",
        "procedure:read",
        "procedure:draft"
      ],
      "api_required": true,
      "browser_required": true
    },
    {
      "role": "procedure_reviewer",
      "permissions": [
        "source:read",
        "document:read",
        "evidence:query",
        "procedure:read",
        "procedure:review"
      ],
      "api_required": true,
      "browser_required": true
    },
    {
      "role": "procedure_approver",
      "permissions": [
        "source:read",
        "document:read",
        "evidence:query",
        "procedure:read",
        "procedure:approve"
      ],
      "api_required": true,
      "browser_required": true
    },
    {
      "role": "case_operator",
      "permissions": [
        "document:read",
        "evidence:query",
        "procedure:read",
        "case:read",
        "case:write"
      ],
      "api_required": true,
      "browser_required": true
    },
    {
      "role": "viewer",
      "permissions": [
        "source:read",
        "document:read",
        "evidence:query",
        "procedure:read",
        "case:read"
      ],
      "api_required": true,
      "browser_required": true
    },
    {
      "role": "integration_client",
      "permissions": [
        "source:read",
        "document:read",
        "evidence:query",
        "procedure:read",
        "integration:query"
      ],
      "api_required": true,
      "browser_required": false
    }
  ],
  "fixtures": [
    {
      "id": "f0000000-0000-4000-8000-000000000001",
      "key": "tenant-a-source",
      "tenant_id": "11111111-1111-4111-8111-111111111111",
      "resource_type": "source",
      "mutability": "mutable",
      "synthetic": true,
      "authoritative": false
    },
    {
      "id": "f0000000-0000-4000-8000-000000000002",
      "key": "tenant-a-document",
      "tenant_id": "11111111-1111-4111-8111-111111111111",
      "resource_type": "document",
      "mutability": "mutable",
      "synthetic": true,
      "authoritative": false
    },
    {
      "id": "f0000000-0000-4000-8000-000000000003",
      "key": "tenant-a-ingestion-job",
      "tenant_id": "11111111-1111-4111-8111-111111111111",
      "resource_type": "ingestion_job",
      "mutability": "mutable",
      "synthetic": true,
      "authoritative": false
    },
    {
      "id": "f0000000-0000-4000-8000-000000000004",
      "key": "tenant-a-evidence-bundle",
      "tenant_id": "11111111-1111-4111-8111-111111111111",
      "resource_type": "evidence_bundle",
      "mutability": "immutable_snapshot",
      "synthetic": true,
      "authoritative": false
    },
    {
      "id": "f0000000-0000-4000-8000-000000000005",
      "key": "tenant-a-workflow-version",
      "tenant_id": "11111111-1111-4111-8111-111111111111",